{
  "$schema": "https://json-schema.org/draft/2020-12/schema",
  "$id": "https://verityspec.org/schemas/v0.1/unity/unity-prefab.schema.json",
  "title": "Unity Prefab",
  "type": "object",
  "additionalProperties": false,
  "required": [
    "id",
    "kind",
    "name",
    "status",
    "owner",
    "description",
    "prefabPath",
    "prefabRole",
    "references"
  ],
  "properties": {
    "id": {
      "type": "string",
      "pattern": "^[a-z][a-z0-9]*(?:[._-][a-z0-9]+)*$"
    },
    "kind": {
      "type": "string",
      "const": "unity.prefab"
    },
    "name": {
      "type": "string",
      "minLength": 1
    },
    "description": {
      "type": "string",
      "minLength": 1
    },
    "status": {
      "type": "string",
      "enum": ["draft", "review", "ready", "deprecated", "removed"]
    },
    "owner": {
      "type": "string",
      "minLength": 1
    },
    "prefabPath": {
      "type": "string",
      "minLength": 1
    },
    "prefabRole": {
      "type": "string",
      "enum": ["player", "ui", "system", "environment", "test", "other"]
    },
    "componentSummary": {
      "type": "array",
      "items": {
        "type": "string",
        "minLength": 1
      },
      "default": []
    },
    "references": {
      "$ref": "#/$defs/references"
    }
  },
  "$defs": {
    "references": {
      "type": "array",
      "items": {
        "type": "object",
        "additionalProperties": false,
        "required": ["type", "target"],
        "properties": {
          "type": {
            "type": "string",
            "minLength": 1
          },
          "target": {
            "type": "string",
            "minLength": 1
          },
          "required": {
            "type": "boolean",
            "default": true
          }
        }
      },
      "default": []
    }
  }
}
